SqlDatabaseOptions, property, int, DelayedDurabilityMode, SqlPlatforms.Sql120AndUp,
SqlDatabaseOptions, property, int, QueryStoreDesiredState, SqlPlatforms.Sql130AndUpAndSqlAzureV12,
SqlDatabaseOptions, property, int, QueryStoreCaptureMode, SqlPlatforms.Sql130AndUpAndSqlAzureV12,
SqlDatabaseOptions, property, int, QueryStoreFlushInterval, SqlPlatforms.Sql130AndUpAndSqlAzureV12,
SqlDatabaseOptions, property, int, QueryStoreIntervalLength, SqlPlatforms.Sql130AndUpAndSqlAzureV12,
SqlDatabaseOptions, property, int, QueryStoreMaxStorageSize, SqlPlatforms.Sql130AndUpAndSqlAzureV12,
SqlDatabaseOptions, property, int, QueryStoreMaxPlansPerQuery, SqlPlatforms.Sql130AndUpAndSqlAzureV12,
SqlDatabaseOptions, property, int, QueryStoreStaleQueryThreshold, SqlPlatforms.Sql130AndUpAndSqlAzureV12,
SqlDatabaseOptions, property, int, MaxDop, SqlPlatforms.Sql130AndUpAndSqlAzureV12,
SqlDatabaseOptions, property, int?, MaxDopForSecondary, SqlPlatforms.Sql130AndUpAndSqlAzureV12,
SqlDatabaseOptions, property, bool, LegacyCardinalityEstimation, SqlPlatforms.Sql130AndUpAndSqlAzureV12,
SqlDatabaseOptions, property, bool?, LegacyCardinalityEstimationForSecondary, SqlPlatforms.Sql130AndUpAndSqlAzureV12,
SqlDatabaseOptions, property, bool, ParameterSniffing, SqlPlatforms.Sql130AndUpAndSqlAzureV12,
SqlDatabaseOptions, property, bool?, ParameterSniffingForSecondary, SqlPlatforms.Sql130AndUpAndSqlAzureV12,
SqlDatabaseOptions, property, bool, QueryOptimizerHotfixes, SqlPlatforms.Sql130AndUpAndSqlAzureV12,
SqlDatabaseOptions, property, bool?, QueryOptimizerHotfixesForSecondary, SqlPlatforms.Sql130AndUpAndSqlAzureV12,
SqlDatabaseOptions, property, bool, RemoteDataEnabled, SqlPlatforms.Sql130AndUp,
SqlDatabaseOptions, property, bool, TemporalHistoryRetentionEnabled, SqlPlatforms.Sql140AndUpAndSqlAzureV12,
SqlDataCompressionOption, property, int, CompressionLevel, SqlPlatforms.Sql100AndUpAndSqlAzureV12,
SqlDataCompressionOption, property, int, PartitionNumber, SqlPlatforms.Sql100AndUpAndSqlAzureV12,
SqlDefault, childRelationship, ISqlLegacyDataConstraintTarget, BoundTargets,  SqlPlatforms.Sql100AndUpAndSqlAzureV12 | SqlPlatforms.Sql90, ModelRelationshipType.Peer
SqlDefault, childRelationship, SqlSchema, Schema,  SqlPlatforms.All, ModelRelationshipType.Hierarchical
SqlDefault, parentRelationship, SqlExtendedProperty, ExtendedProperties,  SqlPlatforms.Sql100AndUpAndSqlAzureV12 | SqlPlatforms.Sql90
SqlDefault, externalProperty, SqlScriptProperty, ExpressionScript,  SqlPlatforms.Sql100AndUpAndSqlAzureV12 | SqlPlatforms.Sql90
SqlDefaultConstraint, childRelationship, SqlColumn, ForColumn,  SqlPlatforms.All, ModelRelationshipType.Peer
SqlDefaultConstraint, childRelationship, ISqlModelElement, ExpressionDependencies,  SqlPlatforms.All, ModelRelationshipType.Peer
SqlDefaultConstraint, childRelationship, ISqlSpecifiesTable, DefiningTable,  SqlPlatforms.All, ModelRelationshipType.Hierarchical
SqlDefaultConstraint, parentRelationship, SqlExtendedProperty, ExtendedProperties,  SqlPlatforms.Sql100AndUpAndSqlAzureV12 | SqlPlatforms.Sql90
SqlDefaultConstraint, property, bool, IsWithValues, SqlPlatforms.All,
SqlDefaultConstraint, property, bool, IsDisabled, SqlPlatforms.All,
SqlDefaultConstraint, externalProperty, SqlScriptProperty, DefaultExpressionScript,  SqlPlatforms.All
SqlDmlTrigger, childRelationship, ISqlColumnSource, Parent,  SqlPlatforms.All, ModelRelationshipType.Hierarchical
SqlDmlTrigger, childRelationship, ISqlModelElement, BodyDependencies,  SqlPlatforms.All, ModelRelationshipType.Peer
SqlDmlTrigger, childRelationship, SqlDynamicColumnSource, DynamicObjects,  SqlPlatforms.All, ModelRelationshipType.Composing
SqlDmlTrigger, childRelationship, SqlUser, User,  SqlPlatforms.All, ModelRelationshipType.Peer
SqlDmlTrigger, childRelationship, SqlLogin, Login,  SqlPlatforms.All, ModelRelationshipType.Peer
SqlDmlTrigger, childRelationship, SqlAssembly, Assembly,  SqlPlatforms.All, ModelRelationshipType.Peer
SqlDmlTrigger, parentRelationship, SqlSignature, Signatures,  SqlPlatforms.OnPremises
SqlDmlTrigger, parentRelationship, SqlExtendedProperty, ExtendedProperties,  SqlPlatforms.Sql100AndUpAndSqlAzureV12 | SqlPlatforms.Sql90
SqlDmlTrigger, property, bool, IsInsertTrigger, SqlPlatforms.All,
SqlDmlTrigger, property, bool, IsUpdateTrigger, SqlPlatforms.All,
SqlDmlTrigger, property, bool, IsDeleteTrigger, SqlPlatforms.All,
SqlDmlTrigger, property, int, InsertOrderRestriction, SqlPlatforms.All,
SqlDmlTrigger, property, int, UpdateOrderRestriction, SqlPlatforms.All,
SqlDmlTrigger, property, int, DeleteOrderRestriction, SqlPlatforms.All,
SqlDmlTrigger, property, bool, IsWithAppend, SqlPlatforms.Sql100AndUpAndSqlAzureV12
SqlDmlTrigger, property, bool, IsNotForReplication, SqlPlatforms.Sql100AndUpAndSqlAzureV12
SqlDmlTrigger, property, bool, IsNativeCompiled, SqlPlatforms.Sql130AndUpAndSqlAzureV12,
SqlDmlTrigger, property, bool, IsSchemaBound, SqlPlatforms.Sql130AndUpAndSqlAzureV12,
SqlDmlTrigger, property, bool, IsEncrypted, SqlPlatforms.Sql100AndUpAndSqlAzureV12
SqlDmlTrigger, property, int, SqlTriggerType, SqlPlatforms.All,
SqlDmlTrigger, property, bool, IsDisabled, SqlPlatforms.All,
SqlDmlTrigger, property, bool?, IsAnsiNullsOn, SqlPlatforms.All,
SqlDmlTrigger, property, bool?, IsQuotedIdentifierOn, SqlPlatforms.All,
SqlDmlTrigger, property, bool, IsCaller, SqlPlatforms.All,
SqlDmlTrigger, property, bool, IsSelf, SqlPlatforms.All,
SqlDmlTrigger, property, bool, IsOwner, SqlPlatforms.All,
SqlDmlTrigger, property, string, MethodName, SqlPlatforms.All,
SqlDmlTrigger, property, string, ClassName, SqlPlatforms.All,
SqlDmlTrigger, externalProperty, SqlScriptProperty, BodyScript,  SqlPlatforms.All
SqlDynamicColumnSource, childRelationship, SqlColumn, Columns,  SqlPlatforms.All, ModelRelationshipType.Composing
SqlDynamicColumnSource, parentRelationship, SqlIndex, Indexes,  SqlPlatforms.All
SqlDynamicColumnSource, parentRelationship, SqlDmlTrigger, Triggers,  SqlPlatforms.All
SqlEndpoint, childRelationship, ISqlProtocolSpecifier, ProtocolSpecifier,  SqlPlatforms.OnPremises, ModelRelationshipType.Composing
SqlEndpoint, childRelationship, ISqlEndpointLanguageSpecifier, PayloadSpecifier,  SqlPlatforms.OnPremises, ModelRelationshipType.Composing
SqlEndpoint, childRelationship, ISqlServerObjectAuthorizer, Authorizer,  SqlPlatforms.All, ModelRelationshipType.Peer
SqlEndpoint, parentRelationship, SqlPermissionStatement, Permissions,  SqlPlatforms.All
SqlEndpoint, property, int, State, SqlPlatforms.OnPremises,
SqlEndpoint, property, int, Protocol, SqlPlatforms.OnPremises,
SqlEndpoint, property, int, Payload, SqlPlatforms.OnPremises,
SqlErrorMessage, property, int, MessageNumber, SqlPlatforms.OnPremises,
SqlErrorMessage, property, int, Severity, SqlPlatforms.OnPremises,
SqlErrorMessage, property, string, MessageText, SqlPlatforms.OnPremises,
SqlErrorMessage, property, string, Language, SqlPlatforms.OnPremises,
SqlErrorMessage, property, bool, IsWithLog, SqlPlatforms.OnPremises,
SqlEventGroupSpecifier, property, int, EventGroup, SqlPlatforms.All,
SqlEventSession, childRelationship, SqlEventSessionDefinitions, Definitions,  SqlPlatforms.Sql100AndUpAndSqlAzureV12, ModelRelationshipType.Composing
SqlEventSession, childRelationship, SqlEventSessionTarget, Targets,  SqlPlatforms.Sql100AndUpAndSqlAzureV12, ModelRelationshipType.Composing
SqlEventSession, property, int, SessionScope, SqlPlatforms.Sql100AndUpAndSqlAzureV12,
SqlEventSession, property, int, MaxMemory, SqlPlatforms.Sql100AndUpAndSqlAzureV12,
SqlEventSession, property, int, MaxMemorySpecifiedAs, SqlPlatforms.Sql100AndUpAndSqlAzureV12,
SqlEventSession, property, int, EventRetentionMode, SqlPlatforms.Sql100AndUpAndSqlAzureV12,
SqlEventSession, property, int, MaxDispatchLatencySeconds, SqlPlatforms.Sql100AndUpAndSqlAzureV12,
SqlEventSession, property, int, MaxEventSize, SqlPlatforms.Sql100AndUpAndSqlAzureV12,
SqlEventSession, property, int, MaxEventSizeSpecifiedAs, SqlPlatforms.Sql100AndUpAndSqlAzureV12,
SqlEventSession, property, int, MemoryPartitionMode, SqlPlatforms.Sql100AndUpAndSqlAzureV12,
SqlEventSession, property, bool, IsOnTrackCausality, SqlPlatforms.Sql100AndUpAndSqlAzureV12,
SqlEventSession, property, bool, IsOnStartupState, SqlPlatforms.Sql100AndUpAndSqlAzureV12,
SqlEventSessionAction, property, string, EventModuleGuid, SqlPlatforms.Sql100AndUpAndSqlAzureV12,
SqlEventSessionAction, property, string, EventPackageName, SqlPlatforms.Sql100AndUpAndSqlAzureV12,
SqlEventSessionAction, property, string, ActionName, SqlPlatforms.Sql100AndUpAndSqlAzureV12,
SqlEventSessionDefinitions, childRelationship, SqlEventSessionSetting, AttributeSettings,  SqlPlatforms.Sql100AndUpAndSqlAzureV12, ModelRelationshipType.Composing
SqlEventSessionDefinitions, childRelationship, SqlEventSessionAction, Actions,  SqlPlatforms.Sql100AndUpAndSqlAzureV12, ModelRelationshipType.Composing
SqlEventSessionDefinitions, parentRelationship, SqlEventSessionBase, Parent,  SqlPlatforms.Sql100AndUpAndSqlAzureV12
SqlEventSessionDefinitions, property, string, EventModuleGuid, SqlPlatforms.Sql100AndUpAndSqlAzureV12,
SqlEventSessionDefinitions, property, string, EventPackageName, SqlPlatforms.Sql100AndUpAndSqlAzureV12,
SqlEventSessionDefinitions, property, string, EventName, SqlPlatforms.Sql100AndUpAndSqlAzureV12,
SqlEventSessionDefinitions, externalProperty, SqlScriptProperty, WhereExpression,  SqlPlatforms.Sql100AndUpAndSqlAzureV12
SqlEventSessionSetting, property, string, SettingName, SqlPlatforms.Sql100AndUpAndSqlAzureV12,
SqlEventSessionSetting, externalProperty, SqlScriptProperty, SettingValue,  SqlPlatforms.Sql100AndUpAndSqlAzureV12
SqlEventSessionTarget, childRelationship, SqlEventSessionSetting, ParameterSettings,  SqlPlatforms.Sql100AndUpAndSqlAzureV12, ModelRelationshipType.Composing
SqlEventSessionTarget, property, string, EventModuleGuid, SqlPlatforms.Sql100AndUpAndSqlAzureV12,
SqlEventSessionTarget, property, string, EventPackageName, SqlPlatforms.Sql100AndUpAndSqlAzureV12,
SqlEventSessionTarget, property, string, TargetName, SqlPlatforms.Sql100AndUpAndSqlAzureV12,
SqlEventTypeSpecifier, property, int, EventType, SqlPlatforms.All,
SqlExtendedProcedure, childRelationship, SqlSubroutineParameter, Parameters,  SqlPlatforms.All, ModelRelationshipType.Composing
SqlExtendedProcedure, childRelationship, SqlSchema, Schema,  SqlPlatforms.All, ModelRelationshipType.Hierarchical
SqlExtendedProcedure, childRelationship, SqlUser, User,  SqlPlatforms.All, ModelRelationshipType.Peer
SqlExtendedProcedure, childRelationship, SqlLogin, Login,  SqlPlatforms.All, ModelRelationshipType.Peer
SqlExtendedProcedure, parentRelationship, SqlPermissionStatement, Permissions,  SqlPlatforms.All
SqlExtendedProcedure, property, bool, IsEncrypted, SqlPlatforms.Sql100AndUpAndSqlAzureV12
SqlExtendedProcedure, property, bool, IsCaller, SqlPlatforms.All,
SqlExtendedProcedure, property, bool, IsSelf, SqlPlatforms.All,
SqlExtendedProcedure, property, bool, IsOwner, SqlPlatforms.All,
SqlExtendedProperty, childRelationship, ISqlExtendedPropertyHost, Host,  SqlPlatforms.Sql100AndUpAndSqlAzureV12 | SqlPlatforms.Sql90, ModelRelationshipType.Hierarchical
SqlExtendedProperty, externalProperty, SqlScriptProperty, Value,  SqlPlatforms.Sql100AndUpAndSqlAzureV12 | SqlPlatforms.Sql90
SqlExternalDataSource, childRelationship, SqlDatabaseCredential, Credential,  SqlPlatforms.Sql130AndUpAndSqlAzureV12, ModelRelationshipType.Peer
SqlExternalDataSource, parentRelationship, SqlExternalTable, ExternalTables,  SqlPlatforms.Sql130AndUpAndSqlAzureV12
SqlExternalDataSource, parentRelationship, SqlPermissionStatement, Permissions,  SqlPlatforms.All
SqlExternalDataSource, property, int, DataSourceType, SqlPlatforms.Sql130AndUpAndSqlAzureV12,
SqlExternalDataSource, property, string, Location, SqlPlatforms.Sql130AndUpAndSqlAzureV12,
SqlExternalDataSource, property, string, ResourceManagerLocation, SqlPlatforms.Sql130AndUp,
SqlExternalDataSource, property, string, DatabaseName, SqlPlatforms.SqlAzureV12,
SqlExternalDataSource, property, string, ShardMapName, SqlPlatforms.SqlAzureV12,
SqlExternalFileFormat, parentRelationship, SqlExternalTable, ExternalTables,  SqlPlatforms.Sql130AndUp
SqlExternalFileFormat, parentRelationship, SqlPermissionStatement, Permissions,  SqlPlatforms.All
SqlExternalFileFormat, property, int, FormatType, SqlPlatforms.Sql130AndUp,
SqlExternalFileFormat, property, string, SerDeMethod, SqlPlatforms.Sql130AndUp,
SqlExternalFileFormat, property, string, FieldTerminator, SqlPlatforms.Sql130AndUp,
SqlExternalFileFormat, property, string, StringDelimiter, SqlPlatforms.Sql130AndUp,
SqlExternalFileFormat, property, string, DateFormat, SqlPlatforms.Sql130AndUp,
SqlExternalFileFormat, property, bool, UseTypeDefault, SqlPlatforms.Sql130AndUp,
SqlExternalFileFormat, property, string, DataCompression, SqlPlatforms.Sql130AndUp,
SqlExternalTable, childRelationship, SqlExternalDataSource, DataSourceName,  SqlPlatforms.Sql130AndUpAndSqlAzureV12, ModelRelationshipType.Peer
SqlExternalTable, childRelationship, SqlExternalFileFormat, FileFormatName,  SqlPlatforms.Sql130AndUp, ModelRelationshipType.Peer
SqlExternalTable, childRelationship, SqlColumn, ShardingColumn,  SqlPlatforms.SqlAzureV12, ModelRelationshipType.Peer
SqlExternalTable, childRelationship, SqlColumn, Columns,  SqlPlatforms.All, ModelRelationshipType.Composing
SqlExternalTable, childRelationship, SqlSchema, Schema,  SqlPlatforms.All, ModelRelationshipType.Hierarchical
SqlExternalTable, childRelationship, SqlFilegroup, Filegroup,  SqlPlatforms.Sql100AndUpAndSqlAzureV12 | SqlPlatforms.Sql90, ModelRelationshipType.Peer
SqlExternalTable, childRelationship, SqlPartitionScheme, PartitionScheme,  SqlPlatforms.Sql100AndUpAndSqlAzureV12 | SqlPlatforms.Sql90, ModelRelationshipType.Peer
SqlExternalTable, childRelationship, SqlColumn, PartitionColumn,  SqlPlatforms.Sql100AndUpAndSqlAzureV12 | SqlPlatforms.Sql90, ModelRelationshipType.Peer
SqlExternalTable, childRelationship, SqlFilegroup, FileStreamFilegroup,  SqlPlatforms.Sql100AndUp, ModelRelationshipType.Peer
SqlExternalTable, childRelationship, SqlPartitionScheme, FileStreamPartitionScheme,  SqlPlatforms.Sql100AndUp, ModelRelationshipType.Peer
SqlExternalTable, childRelationship, SqlDataCompressionOption, DataCompressionOptions,  SqlPlatforms.Sql100AndUpAndSqlAzureV12, ModelRelationshipType.Composing
SqlExternalTable, parentRelationship, SqlColumnStoreIndex, ColumnStoreIndexes,  SqlPlatforms.Sql110AndUpAndSqlAzureV12
SqlExternalTable, parentRelationship, SqlIndex, Indexes,  SqlPlatforms.All
SqlExternalTable, parentRelationship, SqlDmlTrigger, Triggers,  SqlPlatforms.All
SqlExternalTable, parentRelationship, SqlExtendedProperty, ExtendedProperties,  SqlPlatforms.Sql100AndUpAndSqlAzureV12 | SqlPlatforms.Sql90
SqlExternalTable, parentRelationship, SqlPermissionStatement, Permissions,  SqlPlatforms.All
SqlExternalTable, parentRelationship, SqlConstraint, Constraints,  SqlPlatforms.All
SqlExternalTable, parentRelationship, SqlStatistic, Statistics,  SqlPlatforms.All
SqlExternalTable, parentRelationship, SqlFullTextIndex, FullTextIndex,  SqlPlatforms.Sql100AndUpAndSqlAzureV12 | SqlPlatforms.Sql90
SqlExternalTable, parentRelationship, SqlSynonym, Synonyms,  SqlPlatforms.All
SqlExternalTable, parentRelationship, SqlSignature, Signatures,  SqlPlatforms.OnPremises
SqlExternalTable, property, string, Location, SqlPlatforms.Sql130AndUp,
SqlExternalTable, property, int?, RejectType, SqlPlatforms.Sql130AndUp,
SqlExternalTable, property, double?, RejectValue, SqlPlatforms.Sql130AndUp,
SqlExternalTable, property, double?, RejectSampleValue, SqlPlatforms.Sql130AndUp,
SqlExternalTable, property, int, DistributionPolicyType, SqlPlatforms.SqlAzureV12,
SqlExternalTable, property, string, ExternalSchemaName, SqlPlatforms.SqlAzureV12,
SqlExternalTable, property, string, ExternalObjectName, SqlPlatforms.SqlAzureV12,
SqlExternalTable, property, int, LockEscalation, SqlPlatforms.Sql100AndUpAndSqlAzureV12
SqlExternalTable, property, bool, IsTableLockOnBulkLoad, SqlPlatforms.All,
SqlExternalTable, property, bool?, IsAnsiNullsOn, SqlPlatforms.All,
SqlExternalTable, property, bool?, IsQuotedIdentifierOn, SqlPlatforms.All,
SqlExternalTable, property, bool?, IsFileStreamNull, SqlPlatforms.Sql100AndUp,
SqlFile, childRelationship, SqlFilegroup, Filegroup,  SqlPlatforms.OnPremises, ModelRelationshipType.Hierarchical
SqlFile, parentRelationship, SqlExtendedProperty, ExtendedProperties,  SqlPlatforms.Sql100AndUpAndSqlAzureV12 | SqlPlatforms.Sql90
SqlFile, property, string, FileName, SqlPlatforms.OnPremises,
SqlFile, property, int?, Size, SqlPlatforms.OnPremises,
SqlFile, property, int, SizeUnit, SqlPlatforms.OnPremises,
SqlFile, property, int?, MaxSize, SqlPlatforms.OnPremises,
SqlFile, property, int, MaxSizeUnit, SqlPlatforms.OnPremises,
SqlFile, property, bool, IsUnlimited, SqlPlatforms.OnPremises,
SqlFile, property, int?, FileGrowth, SqlPlatforms.OnPremises,
SqlFile, property, int, FileGrowthUnit, SqlPlatforms.OnPremises,
SqlFile, property, bool, IsLogFile, SqlPlatforms.OnPremises,
SqlFile, property, bool, IsOffline, SqlPlatforms.OnPremises,
SqlFilegroup, parentRelationship, ISqlSpecifiesStorage, StoredObjects,  SqlPlatforms.Sql100AndUpAndSqlAzureV12 | SqlPlatforms.Sql90
SqlFilegroup, parentRelationship, SqlTableBase, TextImagedTable,  SqlPlatforms.OnPremises
SqlFilegroup, parentRelationship, SqlFile, Files,  SqlPlatforms.OnPremises
SqlFilegroup, parentRelationship, SqlDatabaseOptions, DefaultOf,  SqlPlatforms.Sql100AndUpAndSqlAzureV12 | SqlPlatforms.Sql90
SqlFilegroup, parentRelationship, ISqlSpecifiesFileStream, StoredFileStreamObjects,  SqlPlatforms.Sql100AndUp
SqlFilegroup, parentRelationship, SqlDatabaseOptions, DefaultOfFileStream,  SqlPlatforms.Sql100AndUp
SqlFilegroup, parentRelationship, SqlExtendedProperty, ExtendedProperties,  SqlPlatforms.Sql100AndUpAndSqlAzureV12 | SqlPlatforms.Sql90
SqlFilegroup, property, bool, IsReadOnly, SqlPlatforms.OnPremises,
SqlFilegroup, property, bool, DoesContainFileStream, SqlPlatforms.Sql100AndUp,
SqlFilegroup, property, bool, ContainsMemoryOptimizedData, SqlPlatforms.Sql120AndUp,
SqlFilegroupSpecifier, childRelationship, SqlFilegroup, Filegroup,  SqlPlatforms.OnPremises, ModelRelationshipType.Peer
SqlFilegroupSpecifier, property, bool, IsDefault, SqlPlatforms.OnPremises,
SqlFileTable, childRelationship, SqlColumn, Columns,  SqlPlatforms.All, ModelRelationshipType.Composing
SqlFileTable, childRelationship, SqlSchema, Schema,  SqlPlatforms.All, ModelRelationshipType.Hierarchical
SqlFileTable, childRelationship, SqlFilegroup, Filegroup,  SqlPlatforms.Sql100AndUpAndSqlAzureV12 | SqlPlatforms.Sql90, ModelRelationshipType.Peer
SqlFileTable, childRelationship, SqlPartitionScheme, PartitionScheme,  SqlPlatforms.Sql100AndUpAndSqlAzureV12 | SqlPlatforms.Sql90, ModelRelationshipType.Peer
SqlFileTable, childRelationship, SqlColumn, PartitionColumn,  SqlPlatforms.Sql100AndUpAndSqlAzureV12 | SqlPlatforms.Sql90, ModelRelationshipType.Peer
SqlFileTable, childRelationship, SqlFilegroup, FileStreamFilegroup,  SqlPlatforms.Sql100AndUp, ModelRelationshipType.Peer
SqlFileTable, childRelationship, SqlPartitionScheme, FileStreamPartitionScheme,  SqlPlatforms.Sql100AndUp, ModelRelationshipType.Peer
SqlFileTable, childRelationship, SqlDataCompressionOption, DataCompressionOptions,  SqlPlatforms.Sql100AndUpAndSqlAzureV12, ModelRelationshipType.Composing
SqlFileTable, parentRelationship, SqlColumnStoreIndex, ColumnStoreIndexes,  SqlPlatforms.Sql110AndUpAndSqlAzureV12
SqlFileTable, parentRelationship, SqlIndex, Indexes,  SqlPlatforms.All
SqlFileTable, parentRelationship, SqlDmlTrigger, Triggers,  SqlPlatforms.All
SqlFileTable, parentRelationship, SqlExtendedProperty, ExtendedProperties,  SqlPlatforms.Sql100AndUpAndSqlAzureV12 | SqlPlatforms.Sql90
SqlFileTable, parentRelationship, SqlPermissionStatement, Permissions,  SqlPlatforms.All
SqlFileTable, parentRelationship, SqlConstraint, Constraints,  SqlPlatforms.All
SqlFileTable, parentRelationship, SqlStatistic, Statistics,  SqlPlatforms.All
SqlFileTable, parentRelationship, SqlFullTextIndex, FullTextIndex,  SqlPlatforms.Sql100AndUpAndSqlAzureV12 | SqlPlatforms.Sql90
SqlFileTable, parentRelationship, SqlSynonym, Synonyms,  SqlPlatforms.All
SqlFileTable, parentRelationship, SqlSignature, Signatures,  SqlPlatforms.OnPremises
SqlFileTable, property, string, FileTableDirectory, SqlPlatforms.Sql110AndUp,
SqlFileTable, property, string, FileTableCollateFilename, SqlPlatforms.Sql110AndUp,
SqlFileTable, property, bool, IsFileTableNamespaceEnabled, SqlPlatforms.Sql110AndUp,
SqlFileTable, property, int, LockEscalation, SqlPlatforms.Sql100AndUpAndSqlAzureV12
SqlFileTable, property, bool, IsTableLockOnBulkLoad, SqlPlatforms.All,
SqlFileTable, property, bool?, IsAnsiNullsOn, SqlPlatforms.All,
SqlFileTable, property, bool?, IsQuotedIdentifierOn, SqlPlatforms.All,
SqlFileTable, property, bool?, IsFileStreamNull, SqlPlatforms.Sql100AndUp,
SqlForeignKeyConstraint, childRelationship, SqlColumn, Columns,  SqlPlatforms.All, ModelRelationshipType.Peer
SqlForeignKeyConstraint, childRelationship, SqlTableBase, ForeignTable,  SqlPlatforms.All, ModelRelationshipType.Peer
SqlForeignKeyConstraint, childRelationship, SqlColumn, ForeignColumns,  SqlPlatforms.All, ModelRelationshipType.Peer
SqlForeignKeyConstraint, childRelationship, ISqlSpecifiesTable, DefiningTable,  SqlPlatforms.All, ModelRelationshipType.Hierarchical
SqlForeignKeyConstraint, parentRelationship, SqlExtendedProperty, ExtendedProperties,  SqlPlatforms.Sql100AndUpAndSqlAzureV12 | SqlPlatforms.Sql90
SqlForeignKeyConstraint, property, bool, IsNotForReplication, SqlPlatforms.Sql100AndUpAndSqlAzureV12
SqlForeignKeyConstraint, property, int, OnUpdateAction, SqlPlatforms.All,
SqlForeignKeyConstraint, property, int, OnDeleteAction, SqlPlatforms.All,
SqlForeignKeyConstraint, property, bool, IsDisabled, SqlPlatforms.All,
SqlFullTextCatalog, childRelationship, SqlFilegroup, Filegroup,  SqlPlatforms.All, ModelRelationshipType.Peer
SqlFullTextCatalog, childRelationship, ISqlObjectAuthorizer, Authorizer,  SqlPlatforms.All, ModelRelationshipType.Peer
SqlFullTextCatalog, parentRelationship, SqlPermissionStatement, Permissions,  SqlPlatforms.All
SqlFullTextCatalog, property, string, Path, SqlPlatforms.All,
SqlFullTextCatalog, property, bool?, IsAccentSensitive, SqlPlatforms.All,
SqlFullTextCatalog, property, bool, IsDefault, SqlPlatforms.All,
SqlFullTextIndex, childRelationship, ISqlFulltextIndexedObject, IndexedObject,  SqlPlatforms.Sql100AndUpAndSqlAzureV12 | SqlPlatforms.Sql90, ModelRelationshipType.Hierarchical
SqlFullTextIndex, childRelationship, SqlFullTextCatalog, Catalog,  SqlPlatforms.Sql100AndUpAndSqlAzureV12 | SqlPlatforms.Sql90, ModelRelationshipType.Peer
SqlFullTextIndex, childRelationship, ISqlSpecifiesIndex, KeyName,  SqlPlatforms.Sql100AndUpAndSqlAzureV12 | SqlPlatforms.Sql90, ModelRelationshipType.Peer
SqlFullTextIndex, childRelationship, SqlFullTextIndexColumnSpecifier, Columns,  SqlPlatforms.Sql100AndUpAndSqlAzureV12 | SqlPlatforms.Sql90, ModelRelationshipType.Composing
SqlFullTextIndex, childRelationship, SqlFilegroup, Filegroup,  SqlPlatforms.Sql100AndUpAndSqlAzureV12, ModelRelationshipType.Peer
SqlFullTextIndex, childRelationship, SqlFullTextStopList, StopList,  SqlPlatforms.Sql100AndUpAndSqlAzureV12, ModelRelationshipType.Peer
SqlFullTextIndex, childRelationship, SqlSearchPropertyList, SearchPropertyList,  SqlPlatforms.Sql110AndUp, ModelRelationshipType.Peer
SqlFullTextIndex, property, bool, IsDisabled, SqlPlatforms.Sql100AndUpAndSqlAzureV12
SqlFullTextIndex, property, int, ChangeTrackingOption, SqlPlatforms.Sql100AndUpAndSqlAzureV12
SqlFullTextIndex, property, bool, IsStopListOff, SqlPlatforms.Sql100AndUpAndSqlAzureV12,
SqlFullTextIndex, property, bool, DoUseSystemStopList, SqlPlatforms.Sql100AndUpAndSqlAzureV12,
SqlFullTextIndex, property, bool, IsReplicated, SqlPlatforms.OnPremises,
SqlFullTextIndexColumnSpecifier, childRelationship, SqlColumn, Column,  SqlPlatforms.Sql100AndUpAndSqlAzureV12 | SqlPlatforms.Sql90, ModelRelationshipType.Peer
SqlFullTextIndexColumnSpecifier, childRelationship, SqlColumn, TypeColumn,  SqlPlatforms.Sql100AndUpAndSqlAzureV12 | SqlPlatforms.Sql90, ModelRelationshipType.Peer
SqlFullTextIndexColumnSpecifier, property, int?, LanguageId, SqlPlatforms.Sql100AndUpAndSqlAzureV12
SqlFullTextIndexColumnSpecifier, property, bool, IsPartOfStatisticalSemanticAnalysis, SqlPlatforms.Sql110AndUp,
SqlFullTextStopList, childRelationship, ISqlObjectAuthorizer, Authorizer,  SqlPlatforms.All, ModelRelationshipType.Peer
SqlFullTextStopList, parentRelationship, SqlPermissionStatement, Permissions,  SqlPlatforms.All
SqlGenericDatabaseScopedConfigurationOptions, property, int, GenericValueType, SqlPlatforms.Sql140AndUpAndSqlAzureV12,
SqlGenericDatabaseScopedConfigurationOptions, property, string, GenericValue, SqlPlatforms.Sql140AndUpAndSqlAzureV12,
SqlGenericDatabaseScopedConfigurationOptions, property, string, GenericSecondaryValue, SqlPlatforms.Sql140AndUpAndSqlAzureV12,
SqlHttpProtocolSpecifier, property, string, Path, SqlPlatforms.Sql100
SqlHttpProtocolSpecifier, property, int, AuthenticationMode, SqlPlatforms.Sql100
SqlHttpProtocolSpecifier, property, int, Ports, SqlPlatforms.Sql100
SqlHttpProtocolSpecifier, property, bool, IsListeningAllSites, SqlPlatforms.Sql100
SqlHttpProtocolSpecifier, property, bool, IsListeningAllNoneReservedSites, SqlPlatforms.Sql100
SqlHttpProtocolSpecifier, property, string, Website, SqlPlatforms.Sql100
SqlHttpProtocolSpecifier, property, int?, ClearPort, SqlPlatforms.Sql100
SqlHttpProtocolSpecifier, property, int?, SslPort, SqlPlatforms.Sql100
SqlHttpProtocolSpecifier, property, string, AuthenticationRealm, SqlPlatforms.Sql100
SqlHttpProtocolSpecifier, property, string, DefaultLogonDomain, SqlPlatforms.Sql100
SqlHttpProtocolSpecifier, property, bool, IsCompressionEnabled, SqlPlatforms.Sql100
SqlIndex, childRelationship, ISqlColumnSource, IndexedObject,  SqlPlatforms.All, ModelRelationshipType.Hierarchical
