SqlRule, childRelationship, SqlSchema, Schema,  SqlPlatforms.All, ModelRelationshipType.Hierarchical
SqlRule, parentRelationship, SqlExtendedProperty, ExtendedProperties,  SqlPlatforms.Sql100AndUpAndSqlAzureV12 | SqlPlatforms.Sql90
SqlRule, externalProperty, SqlScriptProperty, ExpressionScript,  SqlPlatforms.Sql100AndUpAndSqlAzureV12 | SqlPlatforms.Sql90
SqlScalarFunction, childRelationship, ISqlModelElement, BodyDependencies,  SqlPlatforms.All, ModelRelationshipType.Peer
SqlScalarFunction, childRelationship, SqlTypeSpecifierBase, Type,  SqlPlatforms.All, ModelRelationshipType.Composing
SqlScalarFunction, childRelationship, ISqlFunctionImplementation, FunctionBody,  SqlPlatforms.All, ModelRelationshipType.Composing
SqlScalarFunction, childRelationship, SqlDynamicColumnSource, DynamicObjects,  SqlPlatforms.All, ModelRelationshipType.Composing
SqlScalarFunction, childRelationship, SqlSubroutineParameter, Parameters,  SqlPlatforms.All, ModelRelationshipType.Composing
SqlScalarFunction, childRelationship, SqlSchema, Schema,  SqlPlatforms.All, ModelRelationshipType.Hierarchical
SqlScalarFunction, childRelationship, SqlUser, User,  SqlPlatforms.All, ModelRelationshipType.Peer
SqlScalarFunction, childRelationship, SqlLogin, Login,  SqlPlatforms.All, ModelRelationshipType.Peer
SqlScalarFunction, parentRelationship, SqlExtendedProperty, ExtendedProperties,  SqlPlatforms.Sql100AndUpAndSqlAzureV12 | SqlPlatforms.Sql90
SqlScalarFunction, parentRelationship, SqlPermissionStatement, Permissions,  SqlPlatforms.All
SqlScalarFunction, parentRelationship, SqlSynonym, Synonyms,  SqlPlatforms.All
SqlScalarFunction, parentRelationship, SqlSignature, Signatures,  SqlPlatforms.OnPremises
SqlScalarFunction, property, bool, IsInlineable, SqlPlatforms.Sql150AndSqlAzureV12,
SqlScalarFunction, property, bool, IsInline, SqlPlatforms.Sql150AndSqlAzureV12,
SqlScalarFunction, property, bool, IsSchemaBound, SqlPlatforms.All,
SqlScalarFunction, property, bool, DoReturnNullForNullInput, SqlPlatforms.All,
SqlScalarFunction, property, bool, IsCalledForNullInput, SqlPlatforms.All,
SqlScalarFunction, property, bool, IsNativeCompiled, SqlPlatforms.All,
SqlScalarFunction, property, bool, IsEncrypted, SqlPlatforms.Sql100AndUpAndSqlAzureV12
SqlScalarFunction, property, bool, IsCaller, SqlPlatforms.All,
SqlScalarFunction, property, bool, IsSelf, SqlPlatforms.All,
SqlScalarFunction, property, bool, IsOwner, SqlPlatforms.All,
SqlScalarFunction, property, bool?, IsAnsiNullsOn, SqlPlatforms.All,
SqlScalarFunction, property, bool?, IsQuotedIdentifierOn, SqlPlatforms.All,
SqlScalarFunction, property, bool, IsReplicated, SqlPlatforms.OnPremises,
SqlSchema, childRelationship, ISqlObjectAuthorizer, Authorizer,  SqlPlatforms.All, ModelRelationshipType.Peer
SqlSchema, parentRelationship, ISqlSchemaObject, Objects,  SqlPlatforms.All
SqlSchema, parentRelationship, SqlExtendedProperty, ExtendedProperties,  SqlPlatforms.Sql100AndUpAndSqlAzureV12 | SqlPlatforms.Sql90
SqlSchema, parentRelationship, SqlPermissionStatement, Permissions,  SqlPlatforms.All
SqlScript, childRelationship, ISqlModelElement, BodyDependencies,  SqlPlatforms.All, ModelRelationshipType.Peer
SqlScript, property, string, BodyScript, SqlPlatforms.All,
SqlScriptFunctionImplementation, parentRelationship, SqlFunction, Parent,  SqlPlatforms.All
SqlScriptFunctionImplementation, externalProperty, SqlScriptProperty, BodyScript,  SqlPlatforms.All
SqlSearchProperty, childRelationship, SqlSearchPropertyList, SearchPropertyList,  SqlPlatforms.Sql110AndUp, ModelRelationshipType.Hierarchical
SqlSearchProperty, property, string, PropertySetGuid, SqlPlatforms.Sql110AndUp,
SqlSearchProperty, property, int, Identifier, SqlPlatforms.Sql110AndUp,
SqlSearchProperty, property, string, Description, SqlPlatforms.Sql110AndUp,
SqlSearchPropertyList, childRelationship, ISqlObjectAuthorizer, Authorizer,  SqlPlatforms.All, ModelRelationshipType.Peer
SqlSearchPropertyList, parentRelationship, SqlSearchProperty, SearchProperties,  SqlPlatforms.All
SqlSearchPropertyList, parentRelationship, SqlPermissionStatement, Permissions,  SqlPlatforms.All
SqlSecurityPolicy, childRelationship, SqlSecurityPredicate, Predicates,  SqlPlatforms.All, ModelRelationshipType.Composing
SqlSecurityPolicy, childRelationship, SqlSchema, Schema,  SqlPlatforms.All, ModelRelationshipType.Hierarchical
SqlSecurityPolicy, parentRelationship, SqlExtendedProperty, ExtendedProperties,  SqlPlatforms.Sql100AndUpAndSqlAzureV12 | SqlPlatforms.Sql90
SqlSecurityPolicy, property, bool, Enabled, SqlPlatforms.All,
SqlSecurityPolicy, property, bool, NotForReplication, SqlPlatforms.All,
SqlSecurityPolicy, property, bool, IsSchemaBound, SqlPlatforms.All,
SqlSecurityPredicate, childRelationship, ISqlColumnSource, TargetObject,  SqlPlatforms.All, ModelRelationshipType.Peer
SqlSecurityPredicate, childRelationship, ISqlModelElement, BodyDependencies,  SqlPlatforms.All, ModelRelationshipType.Peer
SqlSecurityPredicate, parentRelationship, SqlSecurityPolicy, Parent,  SqlPlatforms.All
SqlSecurityPredicate, property, int, Operation, SqlPlatforms.All,
SqlSecurityPredicate, property, int, PredicateType, SqlPlatforms.All,
SqlSecurityPredicate, externalProperty, SqlScriptProperty, BodyScript,  SqlPlatforms.All
SqlSelectiveXmlIndex, childRelationship, SqlTable, IndexedObject,  SqlPlatforms.Sql110AndUpAndSqlAzureV12, ModelRelationshipType.Hierarchical
SqlSelectiveXmlIndex, childRelationship, SqlColumn, Column,  SqlPlatforms.Sql110AndUpAndSqlAzureV12, ModelRelationshipType.Peer
SqlSelectiveXmlIndex, childRelationship, SqlSelectiveXmlIndex, UsingPrimarySelectiveXmlIndex,  SqlPlatforms.Sql110AndUpAndSqlAzureV12, ModelRelationshipType.Peer
SqlSelectiveXmlIndex, childRelationship, SqlPromotedNodePathBase, ForPrimaryPromotedPath,  SqlPlatforms.Sql110AndUpAndSqlAzureV12, ModelRelationshipType.Peer
SqlSelectiveXmlIndex, childRelationship, SqlXmlNamespace, XmlNamespaces,  SqlPlatforms.Sql110AndUpAndSqlAzureV12, ModelRelationshipType.Composing
SqlSelectiveXmlIndex, childRelationship, SqlPromotedNodePathBase, PromotedPaths,  SqlPlatforms.Sql110AndUpAndSqlAzureV12, ModelRelationshipType.Composing
SqlSelectiveXmlIndex, parentRelationship, SqlExtendedProperty, ExtendedProperties,  SqlPlatforms.Sql100AndUpAndSqlAzureV12 | SqlPlatforms.Sql90
SqlSelectiveXmlIndex, property, bool, IsPrimary, SqlPlatforms.Sql110AndUpAndSqlAzureV12,
SqlSelectiveXmlIndex, property, bool, IsPadded, SqlPlatforms.Sql110AndUpAndSqlAzureV12,
SqlSelectiveXmlIndex, property, int?, FillFactor, SqlPlatforms.Sql110AndUpAndSqlAzureV12,
SqlSelectiveXmlIndex, property, bool, DoAllowRowLocks, SqlPlatforms.Sql110AndUpAndSqlAzureV12,
SqlSelectiveXmlIndex, property, bool, DoAllowPageLocks, SqlPlatforms.Sql110AndUpAndSqlAzureV12,
SqlSelectiveXmlIndex, property, bool, DoIgnoreDuplicateKey, SqlPlatforms.Sql110AndUpAndSqlAzureV12,
SqlSelectiveXmlIndex, property, bool, DoRecomputeStatistics, SqlPlatforms.Sql110AndUpAndSqlAzureV12,
SqlSelectiveXmlIndex, property, bool, IsDisabled, SqlPlatforms.All,
SqlSequence, childRelationship, SqlTypeSpecifierBase, TypeSpecifier,  SqlPlatforms.Sql110AndUpAndSqlAzureV12, ModelRelationshipType.Composing
SqlSequence, childRelationship, SqlSchema, Schema,  SqlPlatforms.All, ModelRelationshipType.Hierarchical
SqlSequence, parentRelationship, SqlPermissionStatement, Permissions,  SqlPlatforms.All
SqlSequence, parentRelationship, SqlSynonym, Synonyms,  SqlPlatforms.All
SqlSequence, parentRelationship, SqlExtendedProperty, ExtendedProperties,  SqlPlatforms.Sql100AndUpAndSqlAzureV12 | SqlPlatforms.Sql90
SqlSequence, property, bool, IsCycling, SqlPlatforms.Sql110AndUpAndSqlAzureV12,
SqlSequence, property, bool, IsCached, SqlPlatforms.Sql110AndUpAndSqlAzureV12,
SqlSequence, property, int?, CacheSize, SqlPlatforms.Sql110AndUpAndSqlAzureV12,
SqlSequence, property, bool, HasNoMaxValue, SqlPlatforms.Sql110AndUpAndSqlAzureV12,
SqlSequence, property, bool, HasNoMinValue, SqlPlatforms.Sql110AndUpAndSqlAzureV12,
SqlSequence, property, string, MinValue, SqlPlatforms.Sql110AndUpAndSqlAzureV12,
SqlSequence, property, string, MaxValue, SqlPlatforms.Sql110AndUpAndSqlAzureV12,
SqlSequence, property, string, Increment, SqlPlatforms.Sql110AndUpAndSqlAzureV12,
SqlSequence, property, string, StartValue, SqlPlatforms.Sql110AndUpAndSqlAzureV12,
SqlServerAudit, property, string, FilePath, SqlPlatforms.Sql100AndUp,
SqlServerAudit, property, int?, MaxSize, SqlPlatforms.Sql100AndUp,
SqlServerAudit, property, int, MaxSizeUnit, SqlPlatforms.Sql100AndUp,
SqlServerAudit, property, bool, IsUnlimitedFileSize, SqlPlatforms.Sql100AndUp,
SqlServerAudit, property, int?, MaxRolloverFiles, SqlPlatforms.Sql100AndUp,
SqlServerAudit, property, bool, IsUnlimitedMaxRolloverFiles, SqlPlatforms.Sql100AndUp,
SqlServerAudit, property, bool, IsReserveDiskSpaceOn, SqlPlatforms.Sql100AndUp,
SqlServerAudit, property, int, QueueDelay, SqlPlatforms.Sql100AndUp,
SqlServerAudit, property, string, AuditGuid, SqlPlatforms.Sql100AndUp,
SqlServerAudit, property, int, OnFailureAction, SqlPlatforms.Sql100AndUp,
SqlServerAudit, property, int, AuditTarget, SqlPlatforms.Sql100AndUp,
SqlServerAudit, property, bool, IsDisabled, SqlPlatforms.Sql100AndUp,
SqlServerAudit, property, int?, MaxFiles, SqlPlatforms.Sql110AndUp,
SqlServerAudit, externalProperty, SqlScriptProperty, PredicateExpression,  SqlPlatforms.Sql110AndUp
SqlServerAuditSpecification, childRelationship, SqlServerAudit, ServerAudit,  SqlPlatforms.Sql100AndUp, ModelRelationshipType.Peer
SqlServerAuditSpecification, childRelationship, SqlAuditActionGroup, AuditActionGroups,  SqlPlatforms.Sql100AndUp, ModelRelationshipType.Composing
SqlServerAuditSpecification, property, bool, IsStateOn, SqlPlatforms.Sql100AndUp,
SqlServerDdlTrigger, childRelationship, SqlTriggerEventTypeSpecifier, EventType,  SqlPlatforms.All, ModelRelationshipType.Composing
SqlServerDdlTrigger, childRelationship, SqlEventGroupSpecifier, EventGroup,  SqlPlatforms.All, ModelRelationshipType.Composing
SqlServerDdlTrigger, childRelationship, ISqlModelElement, BodyDependencies,  SqlPlatforms.All, ModelRelationshipType.Peer
SqlServerDdlTrigger, childRelationship, SqlDynamicColumnSource, DynamicObjects,  SqlPlatforms.All, ModelRelationshipType.Composing
SqlServerDdlTrigger, childRelationship, SqlUser, User,  SqlPlatforms.All, ModelRelationshipType.Peer
SqlServerDdlTrigger, childRelationship, SqlLogin, Login,  SqlPlatforms.All, ModelRelationshipType.Peer
SqlServerDdlTrigger, childRelationship, SqlAssembly, Assembly,  SqlPlatforms.All, ModelRelationshipType.Peer
SqlServerDdlTrigger, property, bool, IsLogon, SqlPlatforms.OnPremises,
SqlServerDdlTrigger, property, bool, IsEncrypted, SqlPlatforms.Sql100AndUpAndSqlAzureV12
SqlServerDdlTrigger, property, int, SqlTriggerType, SqlPlatforms.All,
SqlServerDdlTrigger, property, bool, IsDisabled, SqlPlatforms.All,
SqlServerDdlTrigger, property, bool?, IsAnsiNullsOn, SqlPlatforms.All,
SqlServerDdlTrigger, property, bool?, IsQuotedIdentifierOn, SqlPlatforms.All,
SqlServerDdlTrigger, property, bool, IsCaller, SqlPlatforms.All,
SqlServerDdlTrigger, property, bool, IsSelf, SqlPlatforms.All,
SqlServerDdlTrigger, property, bool, IsOwner, SqlPlatforms.All,
SqlServerDdlTrigger, property, string, MethodName, SqlPlatforms.All,
SqlServerDdlTrigger, property, string, ClassName, SqlPlatforms.All,
SqlServerDdlTrigger, externalProperty, SqlScriptProperty, BodyScript,  SqlPlatforms.All
SqlServerEventNotification, childRelationship, SqlEventTypeSpecifierBase, EventType,  SqlPlatforms.OnPremises, ModelRelationshipType.Composing
SqlServerEventNotification, childRelationship, SqlEventGroupSpecifier, EventGroup,  SqlPlatforms.OnPremises, ModelRelationshipType.Composing
SqlServerEventNotification, parentRelationship, SqlExtendedProperty, ExtendedProperties,  SqlPlatforms.Sql100AndUpAndSqlAzureV12 | SqlPlatforms.Sql90
SqlServerEventNotification, property, bool, IsWithFanIn, SqlPlatforms.OnPremises,
SqlServerEventNotification, property, string, BrokerInstanceSpecifier, SqlPlatforms.OnPremises,
SqlServerEventNotification, property, string, Service, SqlPlatforms.OnPremises,
SqlServerOptions, parentRelationship, SqlPermissionStatement, Permissions,  SqlPlatforms.All
SqlServerRoleMembership, childRelationship, SqlServerSecurityPrincipal, Member,  SqlPlatforms.All, ModelRelationshipType.Peer
SqlServerRoleMembership, childRelationship, ISqlServerRole, Role,  SqlPlatforms.All, ModelRelationshipType.Hierarchical
SqlService, childRelationship, SqlQueue, Queue,  SqlPlatforms.OnPremises, ModelRelationshipType.Peer
SqlService, childRelationship, SqlContract, Contracts,  SqlPlatforms.OnPremises, ModelRelationshipType.Peer
SqlService, childRelationship, ISqlObjectAuthorizer, Authorizer,  SqlPlatforms.All, ModelRelationshipType.Peer
SqlService, parentRelationship, SqlExtendedProperty, ExtendedProperties,  SqlPlatforms.Sql100AndUpAndSqlAzureV12 | SqlPlatforms.Sql90
SqlService, parentRelationship, SqlPermissionStatement, Permissions,  SqlPlatforms.All
SqlService, property, bool, UseDefaultContract, SqlPlatforms.OnPremises,
SqlServiceBrokerLanguageSpecifier, childRelationship, SqlCertificate, AuthenticationCertificate,  SqlPlatforms.OnPremises, ModelRelationshipType.Peer
SqlServiceBrokerLanguageSpecifier, property, int, AuthenticationWindowsMode, SqlPlatforms.OnPremises,
SqlServiceBrokerLanguageSpecifier, property, bool, DoUseCertificateFirst, SqlPlatforms.OnPremises,
SqlServiceBrokerLanguageSpecifier, property, int, EncryptionMode, SqlPlatforms.OnPremises,
SqlServiceBrokerLanguageSpecifier, property, int, EncryptionAlgorithmPart1, SqlPlatforms.OnPremises,
SqlServiceBrokerLanguageSpecifier, property, int, EncryptionAlgorithmPart2, SqlPlatforms.OnPremises,
SqlServiceBrokerLanguageSpecifier, property, bool, IsMessageForwarding, SqlPlatforms.OnPremises,
SqlServiceBrokerLanguageSpecifier, property, int, MessageForwardSize, SqlPlatforms.OnPremises,
SqlSignature, childRelationship, ISqlSignable, SignedObject,  SqlPlatforms.OnPremises, ModelRelationshipType.Hierarchical
SqlSignature, childRelationship, SqlSignatureEncryptionMechanism, EncryptionMechanism,  SqlPlatforms.OnPremises, ModelRelationshipType.Composing
SqlSignature, property, bool, IsCounter, SqlPlatforms.OnPremises,
SqlSignatureEncryptionMechanism, childRelationship, SqlCertificate, Certificate,  SqlPlatforms.OnPremises, ModelRelationshipType.Peer
SqlSignatureEncryptionMechanism, childRelationship, SqlAsymmetricKey, AsymmetricKey,  SqlPlatforms.OnPremises, ModelRelationshipType.Peer
SqlSignatureEncryptionMechanism, property, string, Password, SqlPlatforms.OnPremises,
SqlSignatureEncryptionMechanism, property, string, SignedBlob, SqlPlatforms.OnPremises,
SqlSimpleColumn, childRelationship, SqlColumnEncryptionKey, ColumnEncryptionKey,  SqlPlatforms.Sql130AndUpAndSqlAzureV12, ModelRelationshipType.Peer
SqlSimpleColumn, childRelationship, SqlTypeSpecifierBase, TypeSpecifier,  SqlPlatforms.All, ModelRelationshipType.Composing
SqlSimpleColumn, parentRelationship, ISqlColumnSource, Parent,  SqlPlatforms.All
SqlSimpleColumn, parentRelationship, SqlForeignKeyConstraint, ReferencingForeignKey,  SqlPlatforms.All
SqlSimpleColumn, parentRelationship, SqlDefaultConstraint, Defaults,  SqlPlatforms.All
SqlSimpleColumn, parentRelationship, SqlExtendedProperty, ExtendedProperties,  SqlPlatforms.Sql100AndUpAndSqlAzureV12 | SqlPlatforms.Sql90
SqlSimpleColumn, parentRelationship, SqlPermissionStatement, Permissions,  SqlPlatforms.All
SqlSimpleColumn, parentRelationship, SqlLegacyDataConstraints, RulesDefaults,  SqlPlatforms.Sql100AndUpAndSqlAzureV12 | SqlPlatforms.Sql90
SqlSimpleColumn, property, string, Collation, SqlPlatforms.All,
SqlSimpleColumn, property, bool, IsNullable, SqlPlatforms.All,
SqlSimpleColumn, property, bool, IsIdentity, SqlPlatforms.All,
SqlSimpleColumn, property, bool, IsRowGuidColumn, SqlPlatforms.Sql100AndUpAndSqlAzureV12
SqlSimpleColumn, property, string, IdentitySeed, SqlPlatforms.All,
SqlSimpleColumn, property, string, IdentityIncrement, SqlPlatforms.All,
SqlSimpleColumn, property, bool, IdentityIsNotForReplication, SqlPlatforms.Sql100AndUpAndSqlAzureV12
SqlSimpleColumn, property, bool, IsFileStream, SqlPlatforms.Sql100AndUp,
SqlSimpleColumn, property, bool, IsSparse, SqlPlatforms.Sql100AndUpAndSqlAzureV12
SqlSimpleColumn, property, int, GeneratedAlwaysType, SqlPlatforms.Sql130AndUpAndSqlAzureV12,
SqlSimpleColumn, property, string, MaskingFunction, SqlPlatforms.Sql130AndUpAndSqlAzureV12,
SqlSimpleColumn, property, bool, IsHidden, SqlPlatforms.Sql130AndUpAndSqlAzureV12,
SqlSimpleColumn, property, int, EncryptionType, SqlPlatforms.Sql130AndUpAndSqlAzureV12,
SqlSimpleColumn, property, string, EncryptionAlgorithmName, SqlPlatforms.Sql130AndUpAndSqlAzureV12,
SqlSimpleColumn, property, int, GraphType, SqlPlatforms.Sql140AndUpAndSqlAzureV12,
SqlSimpleColumn, property, bool, IsPseudoColumn, SqlPlatforms.Sql140AndUpAndSqlAzureV12,
SqlSoapLanguageSpecifier, childRelationship, SqlSoapMethodSpecification, WebMethods,  SqlPlatforms.Sql100 | SqlPlatforms.Sql90, ModelRelationshipType.Composing
SqlSoapLanguageSpecifier, property, bool, IsBatchEnabled, SqlPlatforms.Sql100
SqlSoapLanguageSpecifier, property, string, WsdlSpName, SqlPlatforms.Sql100
SqlSoapLanguageSpecifier, property, bool, IsDefaultWsdlSpName, SqlPlatforms.Sql100
SqlSoapLanguageSpecifier, property, bool, IsSessionEnabled, SqlPlatforms.Sql100
SqlSoapLanguageSpecifier, property, int, LoginType, SqlPlatforms.Sql100
SqlSoapLanguageSpecifier, property, int, SessionTimeout, SqlPlatforms.Sql100
SqlSoapLanguageSpecifier, property, bool, IsSessionNeverTimeout, SqlPlatforms.Sql100
SqlSoapLanguageSpecifier, property, string, DatabaseName, SqlPlatforms.Sql100
SqlSoapLanguageSpecifier, property, bool, IsDefaultDatabase, SqlPlatforms.Sql100
SqlSoapLanguageSpecifier, property, string, Namespace, SqlPlatforms.Sql100
SqlSoapLanguageSpecifier, property, bool, IsDefaultNamespace, SqlPlatforms.Sql100
SqlSoapLanguageSpecifier, property, int, SchemaType, SqlPlatforms.Sql100
SqlSoapLanguageSpecifier, property, int, CharacterSet, SqlPlatforms.Sql100
SqlSoapLanguageSpecifier, property, int, HeaderLimit, SqlPlatforms.Sql100
SqlSoapMethodSpecification, childRelationship, SqlSubroutine, RelatedMethod,  SqlPlatforms.Sql100 | SqlPlatforms.Sql90, ModelRelationshipType.Peer
SqlSoapMethodSpecification, property, string, WebMethodNamespace, SqlPlatforms.Sql100
SqlSoapMethodSpecification, property, string, WebMethodAlias, SqlPlatforms.Sql100
SqlSoapMethodSpecification, property, int, MethodSchemaType, SqlPlatforms.Sql100
SqlSoapMethodSpecification, property, int, Format, SqlPlatforms.Sql100
SqlSpatialIndex, childRelationship, SqlTable, IndexedObject,  SqlPlatforms.Sql100AndUpAndSqlAzureV12 | SqlPlatforms.SqlAzure, ModelRelationshipType.Hierarchical
SqlSpatialIndex, childRelationship, SqlColumn, Column,  SqlPlatforms.Sql100AndUpAndSqlAzureV12 | SqlPlatforms.SqlAzure, ModelRelationshipType.Peer
SqlSpatialIndex, childRelationship, SqlFilegroup, Filegroup,  SqlPlatforms.Sql100AndUpAndSqlAzureV12 | SqlPlatforms.Sql90, ModelRelationshipType.Peer
SqlSpatialIndex, childRelationship, SqlPartitionScheme, PartitionScheme,  SqlPlatforms.Sql100AndUpAndSqlAzureV12 | SqlPlatforms.Sql90, ModelRelationshipType.Peer
SqlSpatialIndex, childRelationship, SqlColumn, PartitionColumn,  SqlPlatforms.Sql100AndUpAndSqlAzureV12 | SqlPlatforms.Sql90, ModelRelationshipType.Peer
SqlSpatialIndex, parentRelationship, SqlExtendedProperty, ExtendedProperties,  SqlPlatforms.Sql100AndUpAndSqlAzureV12 | SqlPlatforms.Sql90
SqlSpatialIndex, property, int, Tessellation, SqlPlatforms.Sql100AndUpAndSqlAzureV12
SqlSpatialIndex, property, double?, XMin, SqlPlatforms.Sql100AndUpAndSqlAzureV12
SqlSpatialIndex, property, double?, YMin, SqlPlatforms.Sql100AndUpAndSqlAzureV12
SqlSpatialIndex, property, double?, XMax, SqlPlatforms.Sql100AndUpAndSqlAzureV12
SqlSpatialIndex, property, double?, YMax, SqlPlatforms.Sql100AndUpAndSqlAzureV12
SqlSpatialIndex, property, int, GridDensityLevel1, SqlPlatforms.Sql100AndUpAndSqlAzureV12
SqlSpatialIndex, property, int, GridDensityLevel2, SqlPlatforms.Sql100AndUpAndSqlAzureV12
SqlSpatialIndex, property, int, GridDensityLevel3, SqlPlatforms.Sql100AndUpAndSqlAzureV12
SqlSpatialIndex, property, int, GridDensityLevel4, SqlPlatforms.Sql100AndUpAndSqlAzureV12
SqlSpatialIndex, property, int?, CellsPerObject, SqlPlatforms.Sql100AndUpAndSqlAzureV12
SqlSpatialIndex, property, bool, IsPadded, SqlPlatforms.Sql100AndUpAndSqlAzureV12,
SqlSpatialIndex, property, int, FillFactor, SqlPlatforms.Sql100AndUpAndSqlAzureV12,
SqlSpatialIndex, property, bool, DoIgnoreDuplicateKey, SqlPlatforms.Sql100AndUpAndSqlAzureV12
SqlSpatialIndex, property, bool, DoRecomputeStatistics, SqlPlatforms.Sql100AndUpAndSqlAzureV12
SqlSpatialIndex, property, bool, DoAllowRowLocks, SqlPlatforms.Sql100AndUpAndSqlAzureV12,
SqlSpatialIndex, property, bool, DoAllowPageLocks, SqlPlatforms.Sql100AndUpAndSqlAzureV12,
SqlSpatialIndex, property, int, DataCompression, SqlPlatforms.Sql110AndUpAndSqlAzureV12,
SqlSpatialIndex, property, bool, IsDisabled, SqlPlatforms.All,
SqlStatistic, childRelationship, ISqlStatisticBound, Subject,  SqlPlatforms.All, ModelRelationshipType.Hierarchical
SqlStatistic, childRelationship, SqlColumn, Columns,  SqlPlatforms.All, ModelRelationshipType.Peer
SqlStatistic, childRelationship, ISqlModelElement, ExpressionDependencies,  SqlPlatforms.Sql100AndUpAndSqlAzureV12 | SqlPlatforms.SqlAzure, ModelRelationshipType.Peer
SqlStatistic, property, int, SamplingStyle, SqlPlatforms.All,
SqlStatistic, property, int, SampleSize, SqlPlatforms.All,
SqlStatistic, property, bool, NoRecompute, SqlPlatforms.All,
SqlStatistic, property, string, StatsStream, SqlPlatforms.All,
SqlStatistic, property, bool, Incremental, SqlPlatforms.Sql120AndUpAndSqlAzureV12,
SqlStatistic, externalProperty, SqlScriptProperty, FilterPredicate,  SqlPlatforms.Sql100AndUpAndSqlAzureV12 | SqlPlatforms.SqlAzure
SqlSubroutineParameter, childRelationship, SqlTypeSpecifierBase, Type,  SqlPlatforms.All, ModelRelationshipType.Composing
SqlSubroutineParameter, parentRelationship, SqlExtendedProperty, ExtendedProperties,  SqlPlatforms.Sql100AndUpAndSqlAzureV12 | SqlPlatforms.Sql90
SqlSubroutineParameter, property, bool, IsOutput, SqlPlatforms.All,
SqlSubroutineParameter, property, bool, IsVarying, SqlPlatforms.All,
SqlSubroutineParameter, property, bool, IsReadOnly, SqlPlatforms.Sql100AndUpAndSqlAzureV12
SqlSubroutineParameter, property, bool, IsNullable, SqlPlatforms.Sql130AndUpAndSqlAzureV12,
SqlSubroutineParameter, externalProperty, SqlScriptProperty, DefaultExpressionScript,  SqlPlatforms.All
SqlSymmetricKey, childRelationship, SqlSymmetricKeyEncryptionPassword, EncryptionPasswords,  SqlPlatforms.Sql100AndUpAndSqlAzureV12 | SqlPlatforms.Sql90, ModelRelationshipType.Composing
SqlSymmetricKey, childRelationship, SqlCertificate, EncryptionCertificates,  SqlPlatforms.Sql100AndUpAndSqlAzureV12 | SqlPlatforms.Sql90, ModelRelationshipType.Peer
SqlSymmetricKey, childRelationship, SqlSymmetricKey, EncryptionSymmetricKeys,  SqlPlatforms.Sql100AndUpAndSqlAzureV12 | SqlPlatforms.Sql90, ModelRelationshipType.Peer
SqlSymmetricKey, childRelationship, SqlAsymmetricKey, EncryptionAsymmetricKeys,  SqlPlatforms.OnPremises, ModelRelationshipType.Peer
SqlSymmetricKey, childRelationship, SqlCryptographicProvider, Provider,  SqlPlatforms.Sql100AndUp, ModelRelationshipType.Peer
SqlSymmetricKey, childRelationship, ISqlObjectAuthorizer, Authorizer,  SqlPlatforms.All, ModelRelationshipType.Peer
SqlSymmetricKey, parentRelationship, SqlPermissionStatement, Permissions,  SqlPlatforms.All
SqlSymmetricKey, property, string, KeySource, SqlPlatforms.Sql100AndUpAndSqlAzureV12
SqlSymmetricKey, property, int, Algorithm, SqlPlatforms.Sql100AndUpAndSqlAzureV12
SqlSymmetricKey, property, string, IdentityValue, SqlPlatforms.Sql100AndUpAndSqlAzureV12
SqlSymmetricKey, property, string, ProviderKeyName, SqlPlatforms.Sql100AndUpAndSqlAzureV12,
SqlSymmetricKey, property, int, CreationDisposition, SqlPlatforms.Sql100AndUp,
SqlSymmetricKeyEncryptionPassword, property, string, EncryptionPassword, SqlPlatforms.Sql100AndUpAndSqlAzureV12
SqlSynonym, childRelationship, ISqlSynonymTarget, ForObject,  SqlPlatforms.All, ModelRelationshipType.Peer
SqlSynonym, childRelationship, SqlSchema, Schema,  SqlPlatforms.All, ModelRelationshipType.Hierarchical
SqlSynonym, parentRelationship, SqlExtendedProperty, ExtendedProperties,  SqlPlatforms.Sql100AndUpAndSqlAzureV12 | SqlPlatforms.Sql90
SqlSynonym, parentRelationship, SqlPermissionStatement, Permissions,  SqlPlatforms.All
SqlSynonym, parentRelationship, SqlSynonym, Synonyms,  SqlPlatforms.All
SqlSynonym, externalProperty, SqlScriptProperty, ForObjectScript,  SqlPlatforms.All
SqlTable, childRelationship, SqlDynamicColumnSource, DynamicObjectForChangeTable,  SqlPlatforms.Sql100AndUpAndSqlAzureV12, ModelRelationshipType.Composing
SqlTable, childRelationship, SqlFilegroup, FilegroupForTextImage,  SqlPlatforms.OnPremises, ModelRelationshipType.Peer
SqlTable, childRelationship, SqlTable, TemporalSystemVersioningHistoryTable,  SqlPlatforms.Sql130AndUpAndSqlAzureV12, ModelRelationshipType.Peer
SqlTable, childRelationship, SqlColumn, Columns,  SqlPlatforms.All, ModelRelationshipType.Composing
SqlTable, childRelationship, SqlSchema, Schema,  SqlPlatforms.All, ModelRelationshipType.Hierarchical
SqlTable, childRelationship, SqlFilegroup, Filegroup,  SqlPlatforms.Sql100AndUpAndSqlAzureV12 | SqlPlatforms.Sql90, ModelRelationshipType.Peer
SqlTable, childRelationship, SqlPartitionScheme, PartitionScheme,  SqlPlatforms.Sql100AndUpAndSqlAzureV12 | SqlPlatforms.Sql90, ModelRelationshipType.Peer
SqlTable, childRelationship, SqlColumn, PartitionColumn,  SqlPlatforms.Sql100AndUpAndSqlAzureV12 | SqlPlatforms.Sql90, ModelRelationshipType.Peer
SqlTable, childRelationship, SqlFilegroup, FileStreamFilegroup,  SqlPlatforms.Sql100AndUp, ModelRelationshipType.Peer
SqlTable, childRelationship, SqlPartitionScheme, FileStreamPartitionScheme,  SqlPlatforms.Sql100AndUp, ModelRelationshipType.Peer
